Nome,Minibio,FotoPerfilDrive,NomeObra,DescricaoObra,Thumbnail,MateriaisRecursos,DescricaoExecucao,Link,LinkFotoRaw,LinkThumbnailRaw,LinkObraRaw
Felipe,"Felipe Negreiros é artista digital residente de Fortaleza, seus trabalhos envolvem: “Creative Coding”, 
arte interativa, modelagem 3D, game art, arte imersiva, animação 3D e desenho analógico. Também experimenta dentro do campo da música, toca guitarra , realiza sessões de improviso com músicos de diversas procedências e ocasionalmente experimenta com a música computacional gerada por algoritmos. Sua formação inclui o curso de interatividade e programação criativa da EAV parque lage, um curso de “C4D” para arte 3D e um curso básico de unity para desenvolvimento de jogos, atualmente cursa cinema e audiovisual na Unifor. Suas obras já estiveram expostas em eventos como: Homeostasis Lab, Wrong Bienale, Festival de Chorume, Mostra o Teu, no Festival Psicodelicia e na casa de show Áudio Rebel.  recentemente participou do Ateliê “mestre é quem de repente aprende” no MIS fortaleza e também realizou mostra “Desdobramentos Pixelares” em parceria com o curso de cinema da Unifor.",https://drive.google.com/file/d/1O5K_OdLFBlXWV0tgJFvGvjkzAQpDPk7h/view?usp=sharing,Catedrais de Euclides,"Catedrais de Euclides: Sacralidade e arquitetura são uma combinação usualmente encontrada em catedrais. As estruturas presentes nessa obra evocam essas mesmas características, mas parecem imbuídas de uma Sacralidade não figurativa, mais pautada na geometria, o que as torna bem distintas das catedrais convencionais. E se a fonte da veneração fosse a geometria? Conveio evocar o nome de Euclides, um dos pioneiros da geometria, para incluir de maneira inteligente essa ideia no nome da obra. Mas essas edificações podem ser dedicadas a qualquer um que se empenhe nesse campo do saber.",https://drive.google.com/file/d/1wdsFNU9I53qRnHXegAa_CLuRsOVfoUeP/view?usp=sharing,"Se trata de uma obra interativa que utiliza o teclado e o mouse, Teclas: Q,W,A,S,Z,X,C,V, e setas",https://drive.google.com/drive/folders/1OQcguL9uiQZRpeH_7fCRw2bSzmMxSflJ?usp=sharing,https://drive.google.com/drive/folders/1OQcguL9uiQZRpeH_7fCRw2bSzmMxSflJ?usp=sharing,https://drive.google.com/uc?export=view&id=1O5K_OdLFBlXWV0tgJFvGvjkzAQpDPk7h,https://drive.google.com/uc?export=view&id=1wdsFNU9I53qRnHXegAa_CLuRsOVfoUeP,https://drive.google.com/drive/folders/1OQcguL9uiQZRpeH_7fCRw2bSzmMxSflJ?usp=sharing
Franco Sério,Franco Sério é professor de informática e mestre em Ensino pelo Programa de Pós-Graduação em Criatividade e Inovação em Metodologias de Ensino Superior (PPGCIMES) da UFPA. Pesquisador e admirador da arte de programar segue em busca de encontros e conexões entre a programação e a arte computacional.,https://drive.google.com/file/d/1Rd2stKCUw_2IqoftWpLXtwrGTG1iegRw/view?usp=sharing,Metamorfoses,"A obra “Metamorfoses” foi codificada no p5js e traz em seu processo criativo a criação de borboletas programadas com funções matemáticas tendo como inspiração a arte “Butterfly 1” de Hamid Yeganeh, os versos do poema 11 de ""Biografia do orvalho"" do Livro “Retrato do Artista Quando Coisa”, de Manoel de Barros e a letra da música ""Metamorfose ambulante"" de Raul Seixas. Ela simboliza as transformações no meu processo de aprendizagem interdisciplinar em programação com arte computacional.",https://drive.google.com/file/d/1NV_CBwU19kOwQM20-zRRDrPbftoikMJr/view?usp=sharing,Processing - P5js,"Disponível em ambiente de livecode online (OpenProcessing, p5js Editor, etc)",https://editor.p5js.org/Franco_Serio/full/njBM2Mvh5,https://drive.google.com/uc?export=view&id=1Rd2stKCUw_2IqoftWpLXtwrGTG1iegRw,https://drive.google.com/uc?export=view&id=1NV_CBwU19kOwQM20-zRRDrPbftoikMJr,https://editor.p5js.org/Franco_Serio/full/njBM2Mvh5
Franco Sério,Franco Sério é professor de informática e mestre em Ensino pelo Programa de Pós-Graduação em Criatividade e Inovação em Metodologias de Ensino Superior (PPGCIMES) da UFPA. Pesquisador e admirador da arte de programar segue em busca de encontros e conexões entre a programação e a arte computacional.,https://drive.google.com/file/d/1Rd2stKCUw_2IqoftWpLXtwrGTG1iegRw/view?usp=sharing,Diversidade Codificada - Karla Serrão,"A obra “Diversidade Codificada” tem como processo criativo a construção de uma imagem por várias partículas que surgem na tela e revelam gradativamente o rosto de uma mulher e a beleza de sua diversidade, com uma mensagem impressa de aceitação do sujeito, que se ergue e luta contra o padrão de Ser imposto, que destrói, machuca e desconstrói como a força destrutiva de uma implosão de uma bomba diante da não aceitação da diversidade que habita em cada Ser.  Inspirada na obra “mulher que não é BB” de Waldemar Cordeiro e entrelaçada nos versos do poema “Verbo Ser” de Carlos Drummond de Andrade, do poema “Inexato” de Elisa Lucinda, e, ainda, na letra das músicas “De toda cor” de Renato Luciano e “True Colors” de Cindi Lauper, a obras foi codificada no p5.js, uma interpretação do Processing para a web.",https://drive.google.com/file/d/1FwAerj7tQUAiV3jdOZEUMwoj-Ox6YOgA/view?usp=sharing,Processing - P5js,"Disponível em ambiente de livecode online (OpenProcessing, p5js Editor, etc)",https://editor.p5js.org/Franco_Serio/full/dUzu6I_FI,https://drive.google.com/uc?export=view&id=1Rd2stKCUw_2IqoftWpLXtwrGTG1iegRw,https://drive.google.com/uc?export=view&id=1FwAerj7tQUAiV3jdOZEUMwoj-Ox6YOgA,https://editor.p5js.org/Franco_Serio/full/dUzu6I_FI
Claromes,"""Eu costumava programar como motion designer, agora programo como desenvolvedora criativa""",https://avatars.githubusercontent.com/u/28742647,Pequena história escrita em Python,E assim as noites se passam no meu bairro,https://github.com/claromes/pcd2022/blob/main/tiny_story.gif,Python + py5,Gravado em formato GIF,https://github.com/claromes/pcd2022,https://avatars.githubusercontent.com/u/28742647,https://raw.githubusercontent.com/claromes/pcd2022/main/tiny_story.png,https://github.com/claromes/pcd2022
"Helena Toro, Vinicius Hiroshi, William Peçanha, Marina Taddei, Silvia Laurentiz, Miguel Alonso","Estudantes de Multimídia e Intermídia do curso de graduação em Artes Visuais da ECA/USP, sob orientação da Prof.ª Silvia Laurentiz e monitoria de Miguel Alonso",,Syreni,"A obra parte da imagem de um barco à deriva em um mar cujas ondas se encontram em estabilidade. A voz do interator, captada através do microfone, altera a frequência e a altura das ondulações. À medida que o mar se agita, mudam também as cores do céu e do mar. Ao explorar os efeitos da voz, há também a possibilidade de acalmar as águas, restaurando o equilíbrio do barco. Dessa forma, a obra entrega ao interator, de forma lúdica e figurativa, o controle sobre forças da natureza.
Esse trabalho é motivado pela inquietude gerada pela relação do ser humano com o oceano. Culturalmente, o mar sempre nos provoca e perturba de diferentes formas: atrai e ao mesmo tempo repele, gera medo e reverência, paixão e solitude. Buscamos realizar um projeto que se refere ao poder do oceano, à força das ondas e das tempestades, e seus efeitos sobre a pequena embarcação, uma representação do ser humano.",,p5js,Disponível online em um site,https://maacart.github.io/-Syreni/,https://drive.google.com/uc?export=view&id=1tWMJgqN7tCeafYcg4HPBY_M76_g6RLXE,https://lh5.googleusercontent.com/VBcxxdeFA4jnf2Q_iHEyEchmqtSgoXCdZwD6Ugv-0n2CWLNp4kkzN5BZimOyJl0ht88=w2400,https://maacart.github.io/-Syreni/